tweets_id,text,author_id,username,user_created_time,user_location,user_name,user_description,geo_place_id,geo_country_code,geo_place_type,geo_full_name,geo_bbox,geo_country,geo_name,date
1340461032230285314,"Hey @WSJopinion — From @wsj article:
Worst intelligence failures on record.
— lets remind everyone who is in-charge: #Trump and #Republicans
And #Trump is still denying its Russia.
What’s up with that? 
Care to write a BALANCED opinion instead of peddling misogyny? https://t.co/yTCZHh8b2y",19949233,decafc0de,2009-02-03T02:31:27.000Z,"Manhattan, New York, NY",Pankaj (he/him/his)🏳️‍🌈,"The pursuit of life, liberty, & happiness is innately human. He/him.",01a9a39529b27f36,US,city,"Manhattan, NY","[-74.026675, 40.683935, -73.910408, 40.877483]",Etats-Unis,Manhattan,2020-12-20
1340461029021556737,"@Marina_Sirtis Oh, I'm sure this has been planned, and for a while now.

Over a year ago, Trump suggested a civil war in his name. Since then, we have seen that plan unfold across the Country.

I just hope this Nation proves to be stronger than a single man.

32 days left. https://t.co/M6Oow77Wzk",365754620,sitedenied,2011-08-31T23:38:35.000Z,"Boulder, CO",Jeremy,"I am an educated, gay, poly, liberal actor in Boulder, CO.  And I vote!",fd70c22040963ac7,US,city,"Boulder, CO","[-105.3017759, 39.953552, -105.183597, 40.094411]",Etats-Unis,Boulder,2020-12-20
1340460942409277443,@ProudAmerican82 @axios No it’s the other way around  90% realize and know Biden won. U are a joke Trump. If u expect to win in 2024 if u do run CONCEDE!!! Stop acting ur shoe size. BE A MAN!! Not a spoiled brat who can’t get his way!! YOU LOST!!,1336844611302649856,Michele72466448,2020-12-10T01:26:18.000Z,,Michele Boyer,,e4a0d228eb6be76b,US,city,"Philadelphia, PA","[-75.280284, 39.871811, -74.955712, 40.13792]",Etats-Unis,Philadelphia,2020-12-20
1340460920540160000,@ScriberrNews @mattgaetz @SenatorRomney has been attacking the president because President Trump was getting close to the people who was working china.,1327076813504442368,JimAcos71518230,2020-11-13T02:32:47.000Z,"Miami, FL",Jim Acosta,Today I fight for all the people who have lost a loved one to crime NikkiFried will not benefit parents and their children. We can't afford NikkiFried agenda.,00191b5c37b0bb68,US,city,"Sunshine Parkway, FL","[-80.205987, 26.483803, -80.172485, 26.572955]",Etats-Unis,Sunshine Parkway,2020-12-20
1340460896645091329,Trump’s wall https://t.co/10SS1eRyvL,19423851,larryvenus,2009-01-24T00:10:09.000Z,Sacramento,Larry Venus,California State Senate Employee,3dc5823629ba0580,US,city,"Foothill Farms, CA","[-121.373031, 38.66773, -121.326256, 38.7058589]",Etats-Unis,Foothill Farms,2020-12-20
1340460863791226883,Trump is a mass murderer. https://t.co/09sQyhnoeS,715273562819588096,aagcobb1,2016-03-30T20:24:41.000Z,"Frankfort, KY",aagcobb,"small town lawyer, liberal, believer in the American Dream. Trumpism is Fascism. #VoteBluetosaveAmerica",2a39cded7c6fc606,US,city,"Frankfort, KY","[-84.930744, 38.143682, -84.77634, 38.231254]",Etats-Unis,Frankfort,2020-12-20
1340460817720909824,"Mitch, I cannot tell you how much I was dissappointed by your support of Biden. https://t.co/iR2dJxDHot",322254575,LKmarr,2011-06-22T21:48:46.000Z,,Linda Marr,blvdwmn2003@gmail.com,71d65c0e6d94efab,US,admin,"New Mexico, USA","[-109.050173, 31.332176, -103.002065, 37.000294]",Etats-Unis,New Mexico,2020-12-20
1340460808271261696,@WalshFreedom @MalcolmNance @lorax58 @Ireland0828 @SafetyPinDaily The question on everyone lips is how much money was involved in that shell  company? How much money was laundered? Bet millions were involved. The majority who voted for Biden aren’t stupid. We can read between the lines,552855068,316alco,2012-04-13T17:07:04.000Z,florida,Allen Cohen,,35f9d631a3650f85,US,city,"Poinciana, FL","[-81.520362, 28.061951, -81.432991, 28.218482]",Etats-Unis,Poinciana,2020-12-20
1340460780068679682,"@porphyrogenitus @daveweigel The aughts could have been really sweet if not for that, even with 911. The 2000 election was really consequential.",18192027,alexmhogan,2008-12-17T16:12:01.000Z,"Washington, D.C.",AH,Union communications guy. D.C. resident. I good at words. Catholic Labor Network. Tweets are my opinion and my opinion alone.,01fbe706f872cb32,US,city,"Washington, DC","[-77.119401, 38.801826, -76.909396, 38.9953797]",Etats-Unis,Washington,2020-12-20
1340460755162963968,trump rly asked his advisers if he can call marshall law and hold a new election... what a nerd,2279738457,lexpass_,2014-01-13T19:06:11.000Z,she/her,lex 🌱🐮🐝,"portland, maine",dea1eac2d7ef8878,US,admin,"Maryland, USA","[-79.487651, 37.886607, -74.986286, 39.723622]",Etats-Unis,Maryland,2020-12-20
1340460715153481728,@MrbillREdenver @mongoosenewyork @JimMcDo83752378 @GeraldoRivera @realDonaldTrump @JoeBiden Are you honestly telling me you're good with the election coming up if you thought you need to be observing it that your observers were being told to stay a hundred feet away and oh by the way they'll be remote wagons going out to meet people up to vote. Your bias is showing,26247919,jarmccoy,2009-03-24T14:36:18.000Z,,Julie Anna McCracken,#MAGA #HeIsYourPresident Proud Conservative! Believe you get what you give. Believe in helping those wanting to help themselves.  #Family #FreedomAintFree #DTS,ed8334ef408add50,US,city,"Southfield, MI","[-83.319904, 42.442178, -83.2006443, 42.517441]",Etats-Unis,Southfield,2020-12-20
1340460701161299970,"@GovernorTomWolf @SenToomey doesn’t care about people who have FOOD insecurity now, let alone when Biden is in office.",28648747,jm_snaggletooth,2009-04-03T20:45:33.000Z,Accounting firm CMO,Jonathan Snaggletooth,"Good over evil, sports, & music. Started Ethan's Hope for Humanity to help kids feel special thru music. I don't walk very well, but views are mine, yay me!",dd9c503d6c35364b,US,admin,"Pennsylvania, USA","[-80.519851, 39.719801, -74.689517, 42.516072]",Etats-Unis,Pennsylvania,2020-12-20
1340460651471319042,F. DC / trump be kind @senpattoomey @senatorromney @wefightforeveryone @wefuckinghatedonaldtrump @speakerpelosi @senronjohnson @repaoc @ USA https://t.co/D9vXhjUfaK,24515539,shiffy64,2009-03-15T12:17:44.000Z,"StJohn usvi,Boston,NYC",John Schiff,"Send #reaperdrones to Ukraine🇺🇦,#ukrainecrisis #BLM #insomnia #worldactivist @whatthehelliswrongwithpeople #locktrumpup",01fbe706f872cb32,US,city,"Washington, DC","[-77.119401, 38.801826, -76.909396, 38.9953797]",Etats-Unis,Washington,2020-12-20
1340460642860470274,@thehill Trump has been pro Putin his whole presidency. This guy can do no wrong in his eyes. But he's always been a fan of powerful people. Diaper Don won't be missed...,33910102,ghostrider1974,2009-04-21T13:56:03.000Z,"Bronx, NY",M.A Salamanca,"Poet, Dad, Homechef, USN, Leader, public advocate, Veteran, Cyclist",002e24c6736f069d,US,city,"Bronx, NY","[-73.933612, 40.785365, -73.765271, 40.91533]",Etats-Unis,Bronx,2020-12-20
1340460625995165696,"Actually he stated she was not part of his team of lawyers, but pursuing her own cases on election fraud. Which was a lie 🤯The reason he is now considering appointing her to oversee elections is bc she's nuts enough to cooperate with him should he actually declare Martial Law https://t.co/cUigc0OtIb",1299752897165570050,Brenda60610788,2020-08-29T16:57:30.000Z,"Ohio, USA",Brenda Champagne,I'm a married woman. An aspiring writer. A M❤️M -A grandmother😍 Dont DM me for b💩plz n TY💋I am a DEMOCRAT🇺🇲 I'm a Resister. Blue wave🌊🌊🌊🌊💙BIDEN/HARRIS,de599025180e2ee7,US,admin,"Ohio, USA","[-84.8203089, 38.403186, -80.518626, 42.327133]",Etats-Unis,Ohio,2020-12-20
1340460625911296000,@JumboElliott76 What is really insane is until Biden puts his hand on the Bible I won’t feel safe from that man and the craziness. We can disagree on issues and beliefs. But trump is just a rotten human being. I don’t feel that way on the past presidents I’ve witnessed,143278444,burf24,2010-05-13T02:02:18.000Z,,mark burfield,,317ae80d8be497b0,US,city,"West Elmira, NY","[-76.865898, 42.073207, -76.826257, 42.105614]",Etats-Unis,West Elmira,2020-12-20
1340460622094475264,"@realDonaldTrump had better pay attention.  He lost and its time to suck it up and quit the lies.  Legal action is coming!  @WhiteHouse

After legal threat, Fox airs news package debunking election fraud claims made by its own hosts

https://t.co/iFgeyI1pTZ",1296338870,307WindyWyoming,2013-03-24T19:19:17.000Z,Rocky Mountains,WindyWyoming,"🎶🚻♎⚧BLM 🏳️‍🌈🏁 ❤🎨
Diversity and inclusion for all.
Direct name callers will be blocked.
Agree to disagree, or keep scrolling.
I stand with Ukraine 🇺🇦",1c2babecf6dc0f62,US,city,"Wheatland, WY","[-104.982619, 42.030885, -104.9248, 42.0743448]",Etats-Unis,Wheatland,2020-12-20
1340460561147043840,@kelleyddix @DPWIMM @realDonaldTrump @senatemajldr And here I thought this country was on Auto Pilot because he's not doing a damn thing! Merry Christmas to you. 2021 Biden / Harris!!!!!,1271400767312875521,WANDABENNPHILL1,2020-06-12T11:15:51.000Z,,WANDA BENN PHILLIPS,"Being loved as I love is blissful. I am a Fiance, Mother, and Grandmother. I love to cook, decorate and to look good. I am a Democrat!",c0b8e8dc81930292,US,city,"Baltimore, MD","[-76.7115205, 39.197211, -76.529443, 39.372215]",Etats-Unis,Baltimore,2020-12-20
1340460547200921608,"@Hoosiers1986 Biden's been corrupt from day one, he took bribery, gratuity's and kickback's from Credit Card Giant MBNA so they (all) CC can charge 29% interest for low Credit score card Owners. MOB rates into law and regulatory rules. Thanks lunch pail Job.",43036067,goodnu,2009-05-28T03:17:26.000Z,"Sharon, MA",Goodnu,"Husband, father, Brother, Sailor, Decorated​ Veteran, 32° Free Mason, retired Raytheon Patriot Missile eng., Motorola Broadband Eng. CPM, Real Estate Investor.",b43c6a3ba45e91c3,US,city,"Sharon, MA","[-71.225576, 42.071427, -71.131143, 42.16591]",Etats-Unis,Sharon,2020-12-20
1340460472726908930,"@dantesinfernal @jamiedupree Andy, you know better than that. Trump will leave on Jan 20 with know problem",26351699,BKelnhofer,2009-03-24T23:10:21.000Z,"Florida, USA",Bruce Kelnhofer,"Believer, Husband, Father",4ec01c9dbc693497,US,admin,"Florida, USA","[-87.634643, 24.396308, -79.974307, 31.001056]",Etats-Unis,Florida,2020-12-20
1340460351217946625,Trump's blind following flat-earthers walking to the end of earth. https://t.co/z5RrEZR36Z https://t.co/Tuk799pRRn,1485609469,bobbynorwich22,2013-06-05T17:41:38.000Z,Beautiful Fly Over Country,"Building Back Better, aka JOJ 🌊","Our long national nightmare is FINALLY over! Buh bye, Trump Crime Syndicate. Grammy of 4, lifelong proud Democrat. #Resist #BLM #TruePatriot 🌊🌊🌊",ffca15636bd3943a,US,city,"Landen, OH","[-84.3167541, 39.288723, -84.2526091, 39.338068]",Etats-Unis,Landen,2020-12-20
1340460303688019972,Army Leaders say that They won't interfere in the Election and won't allow Martial Law to Overthrow Our Government even if he asks them to!!!!,165472649,RJP56,2010-07-11T17:31:27.000Z,NewYork,@Edward Lewis,single,a6c257c61f294ec1,US,city,"Greensboro, NC","[-80.0295184, 35.962623, -79.6852086, 36.218171]",Etats-Unis,Greensboro,2020-12-20
tweets_id,text,author_id,username,user_created_time,user_location,user_name,user_description,geo_place_id,geo_country_code,geo_place_type,geo_full_name,geo_bbox,geo_country,geo_name,date
1340527965768040448,@realDonaldTrump @KLoeffler @sendavidperdue Both the Republican candidates for senate in Georgia are criminals just like traitor Trump. They cleaned up during the pandemic through inside information! Should be in jail rather than the senate.,730225258624630784,hskang31,2016-05-11T02:37:23.000Z,,Harpreet S Kang,"Aerospace & Mechanical Engineer by education. Love to teach Math, & Physics etc. Former member of MENSA. Still actively learning important things every day!!",fbd6d2f5a4e4a15e,US,admin,"California, USA","[-124.482003, 32.528832, -114.131212, 42.009519]",Etats-Unis,California,2020-12-20
1340527941596360706,Trump Hate the American people. Trump is Putin puppet . Trump lies everytime he open his mouth. https://t.co/b4XrwJZoJC,1061109464391184384,riv931964,2018-11-10T04:13:05.000Z,"Connecticut, USA",I am so lucky to be alive,"I’m a Tractor-trailer driver for 35 years I love my job , if you follow me I will follow you right back . I believe we are stronger together I’m happy married",7714f2c70ed66321,US,city,"Bridgeport, CT","[-73.244348, 41.141738, -73.153889, 41.229611]",Etats-Unis,Bridgeport,2020-12-20
1340527896667054081,"He's full on Bozo now.
#25thAmendment
Homeland Security told Trump they lacked authority to intervene in election: bombshell report https://t.co/T7yudDMkU5",1354949786,upton1144,2013-04-15T17:58:32.000Z,"Hudson Valley, NY",What's So Radical...,"about wanting us to be paid a living wage, provided healthcare, affordable housing, nutritious food, clean air & water & a life free of discrimination? #Fresh",94965b2c45386f87,US,admin,"New York, USA","[-79.76259, 40.477383, -71.777492, 45.015851]",Etats-Unis,New York,2020-12-20
1340527851070742528,"Redacted Information in Dominion Audit Report Shows Races Were Flipped: Analyst

No matter what they will never release the truth because they are afraid! Biden did not win, it was the most corrupt scam ever pulled on American voters.
https://t.co/TQysQlmfea via @epochtimes",1045236462269222912,Carol96208870,2018-09-27T08:59:26.000Z,,Carol,Married,e86b380cfefcced5,US,admin,"Connecticut, USA","[-73.727776, 40.950918, -71.786994, 42.050588]",Etats-Unis,Connecticut,2020-12-20
1340527828811407360,@BasedDecider haha is that the dem dude who did the never trump thing as a schtick,1105667205222457344,GreatBasinExp57,2019-03-13T03:09:38.000Z,Utah,"Ed, PAC-12 Champions 🇺🇦","University of Utah Stonks+Marching Band 🙌 | Desert Enjoyer | Finance Cowboy | Utes, Giants, Sharks, Niners | 🇲🇽 | #LLTJ #LLAL #LL22 | Ki-Yi!",bd7c511e9f8bc5da,US,city,"Salt Lake City, UT","[-112.0383105, 40.6998952, -111.795741, 40.8317151]",Etats-Unis,Salt Lake City,2020-12-20
1340527786809802753,Trump is headed back to Georgia for an election eve rally on Jan. 4 to boost the Senate Republican runoff candidates  #gapol #gasen https://t.co/Rc60swt1E2,16563015,bluestein,2008-10-02T17:50:51.000Z,ATL,Greg Bluestein,"Husband, father, aspiring mensch. @AJC politics 🗞 @nbcnews contrib 📺 @politicallyga pod 🎧 @wsbradio+@gpbnews 📻 Author of “Flipped”📕 https://t.co/aRuCq2aSe0",9c9fa69deb120a34,US,city,"Dunwoody, GA","[-84.348046, 33.915238, -84.2649311, 33.970907]",Etats-Unis,Dunwoody,2020-12-20
1340527751896436737,@mike_wanaoni @realDonaldTrump @realDonaldTrump is not Afraid of General Flynn. Trump knows good people. Stop trying to stir things up!,957770149712494597,michele_patriot,2018-01-29T00:19:33.000Z,"Florida, USA",michele,"There Are No Problems, Only Solutions!",1b5d6d9c6efabde3,US,city,"Kenneth City, FL","[-82.728681, 27.808138, -82.708134, 27.826339]",Etats-Unis,Kenneth City,2020-12-20
1340527700012912640,"@discipleheart1 @AjmooreMoore @JohnGore1776 @RyanAFournier The state’s  Election Commissioner, the  state’s AG,  the state’s Governor, the state’s Supreme Court, the nation’s AG, and SCOTUS all confirmed the election was legit.  But, you think it was not legit. Where I come from, some people may call you a dumbass.",2649085358,TimeForRates,2014-07-15T19:43:52.000Z,"Wilton, CT",Tim Malburg,"BS from NC State University,  MBA from Cornell University",1cfa9ac27a1e93bd,US,city,"Norwalk, CT","[-73.502636, 41.055206, -73.379243, 41.257357]",Etats-Unis,Norwalk,2020-12-20
1340527648209035265,@realDonaldTrump Yes sir!!!!👍🏻🇺🇸Trump 2020 🇺🇸 and 2000$ payments would really help people out as well 👍🏻,1295166106764804096,LucasBilyeu,2020-08-17T01:10:55.000Z,"Lakeland, FL",Luke bilyeu,"Love living in paradise 🏝🌴🌴 Tampa bay FL,Pipefitter,pipe welder 👨‍🏭 local 123🍻🇺🇸🎉👍🏻🇺🇸west coast beaches an sun ☀️",3f7a925ec706ea48,US,city,"Lakeland, FL","[-82.042715, 27.968692, -81.902695, 28.13051]",Etats-Unis,Lakeland,2020-12-20
1340527555787501568,"@RealCandaceO Hey, Candace Owens what the difference between Russia &amp; China or  similarity? Because you are fine with Russia due Trump. They all communist nation &amp; the republicans regard Russia as friendly to USA. The cybercrime attacks by Russian, Trump blamed the Chinese that is bullshit.",834167384,bihacal2012,2012-09-19T21:26:35.000Z,"Far Rockaway, Queens",Dennis Maitland,Personality,00c39537733fa112,US,city,"Queens, NY","[-73.962582, 40.541722, -73.699793, 40.8000371]",Etats-Unis,Queens,2020-12-20
1340527428259606529,"Zahir Aliyi a potential candidate of OFC in West Hararge,Oromia is in prison. #FreeAllPoliticalPrisonersInEthiopia first to conduct a free and fair election.
@UNDP @EUinEthiopia @DFID_UK @StateDept @USAID @NEBEthiopia @JosepBorrellF
#Plus178CandidatesBehindBars",1319401858058760192,HeboRahima,2020-10-22T22:15:56.000Z,,rahima.hebo@gmail.com,Just have fun with it,300bcc6e23a88361,US,city,"Seattle, WA","[-122.436232, 47.4953154, -122.2249728, 47.734319]",Etats-Unis,Seattle,2020-12-20
1340527427928301572,"@jadaiyuki @LMRoad_93 @IdleSloth84 That statement is patently false. And that is what I disproved. 

But nobody ever said Trump started a war. Because we obviously aren’t at war with any new adversary",1251411316121583622,InfamousLiberal,2020-04-18T07:25:22.000Z,"San Francisco, CA",InfamousLiberalGamer 🐲🎮,"Founder & Administrator of Liberal Gamer Giveaways, Xbox Club: The Console Warlords & Cross Platform Warriors (💰-🏆 Competitive Tourneys)",5a110d312052166f,US,city,"San Francisco, CA","[-122.514926, 37.708075, -122.357031, 37.833238]",Etats-Unis,San Francisco,2020-12-20
1340527365152235521,@JReinerMD Donald Trump- an inept leader who doesn't care if Americans die from COVID.,198034921,slovakheidi,2010-10-03T04:41:23.000Z,"Plainville, CT",Heidi🐱🐶🐦🐸🐢,"Democrat Vaccinated Critters Wildlife Photography #BidenHarris Climate Change

 *Not Here To Date*",000c7ae04f0a875b,US,city,"Plainville, CT","[-72.892836, 41.649293, -72.815501, 41.6980625]",Etats-Unis,Plainville,2020-12-20
1340527292137623553,"Trump: Supporters Should Join ‘Wild’ Protest in DC on Jan. 6 https://t.co/UkLJ1nIcRo
 
Download our app to read more at https://t.co/VORUb3nrxC",3295943761,dsrved759,2015-07-26T19:03:24.000Z,,Ed Welch,"Husband, father, grandfather, church elder, a defender of the Constitution, US Navy RET.",a592bd6ceb1319f7,US,city,"San Diego, CA","[-117.282538, 32.53962, -116.9274403, 33.0804044]",Etats-Unis,San Diego,2020-12-20
1340527268741873664,"All in the Biden crime Syndicate.
Two tiered justice system. https://t.co/RNdup3abj8",519253305,KiniAlohaGuy,2012-03-09T06:51:04.000Z,"Kea'au, Moku o Keawe ",Kini AlohaGuy,"E noho wau i ka Moku o Keawe, e Puna mokuʻāina i ka keona kapa ʻia Kea'au. I live on the Big Island of Hawai'i, in the district of Puna in a town called Kea'au.",9dafd05b1158873b,US,admin,"Hawaï, USA","[-178.443593, 18.86546, -154.755792, 28.517269]",Etats-Unis,Hawaï,2020-12-20
1340527243249000449,"@realDonaldTrump We have volumes of ""Trump Stupid Stories!""  They will be perfect for the Trump Library!!",375334624,BowiesNana,2011-09-17T23:13:34.000Z,"Massachusetts, USA",AFW,"I am a teacher, lifelong learner, mother, world traveler, music lover, beach bum and nana.",74f5dce716bb4008,US,city,"Marshfield, MA","[-70.7729481, 42.0616232, -70.638438, 42.162318]",Etats-Unis,Marshfield,2020-12-20
1340527208981438470,"@funder As I see it, 25th amendment is harder to carry out than an impeachment. Trump should have been removed after his impeachment. Moscow Mitch saved the idiot as did all the Republican cowards in the senate.",730225258624630784,hskang31,2016-05-11T02:37:23.000Z,,Harpreet S Kang,"Aerospace & Mechanical Engineer by education. Love to teach Math, & Physics etc. Former member of MENSA. Still actively learning important things every day!!",fbd6d2f5a4e4a15e,US,admin,"California, USA","[-124.482003, 32.528832, -114.131212, 42.009519]",Etats-Unis,California,2020-12-20
1340527151691386880,"@steinberger_l @GeraldoRivera @realDonaldTrump @JoeBiden Why has every judge thrown out Trump's cases? Because there is no proof of widespread fraud, Trumper!",1233550153937612800,NealDawgFan64,2020-02-29T00:31:21.000Z,"Graham, WA",Medic Mate/Friend of Ukraine,"Veteran. Seahawks, Sounders, Manchester United & Mariners. F Trump. #BlueOasis #Blizzard #Resistance #DemStorm3 #Cannabis#BLM USA ❤ Doctors & Nurses. #Ukraine",08a26cd724eca51d,US,city,"Graham, WA","[-122.338034, 47.016521, -122.206872, 47.09723]",Etats-Unis,Graham,2020-12-20
1340527033172934656,"Jawar Mohammed a potential candidate of OFC in Oromia is in prison. #FreeAllPoliticalPrisonersInEthiopia first to conduct a free and fair election.
@UNDP @EUinEthiopia @DFID_UK @StateDept @USAID @NEBEthiopia @JosepBorrellF
#Plus178CandidatesBehindBars",1319401858058760192,HeboRahima,2020-10-22T22:15:56.000Z,,rahima.hebo@gmail.com,Just have fun with it,300bcc6e23a88361,US,city,"Seattle, WA","[-122.436232, 47.4953154, -122.2249728, 47.734319]",Etats-Unis,Seattle,2020-12-20
1340527016127438850,Trump: Supporters Should Join ‘Wild’ Protest in DC on Jan. 6 https://t.co/kLueuhztKY via @epochtimes help President Trump! Join the protest!,785626230708015104,m_cotton16,2016-10-10T23:41:04.000Z,,MCotton,,23c9865273efcb5c,US,city,"Lakeway, TX","[-98.013875, 30.3221922, -97.942567, 30.389523]",Etats-Unis,Lakeway,2020-12-20
1340527010729263105,@kaitlancollins Comrade Trump is in way to deep to even slide glance.,2248059529,JamespDonovan,2013-12-16T02:33:53.000Z,The Eug,"Jim Donovan, DGAF","Blue Human, Retired Regulator, Nazi Hunter, Attractive Nuisance",01241e9666cacdd2,US,city,"Eugene, OR","[-123.208615, 43.988281, -123.0361879, 44.142961]",Etats-Unis,Eugene,2020-12-20
1340526990625914880,"Nimona Urgesa a potential candidate of OLF in Oromia is in prison. #FreeAllPoliticalPrisonersInEthiopia first to conduct a free and fair election.
@UNDP @EUinEthiopia @DFID_UK @StateDept @USAID @NEBEthiopia @JosepBorrellF
#Plus178CandidatesBehindBars",1319401858058760192,HeboRahima,2020-10-22T22:15:56.000Z,,rahima.hebo@gmail.com,Just have fun with it,300bcc6e23a88361,US,city,"Seattle, WA","[-122.436232, 47.4953154, -122.2249728, 47.734319]",Etats-Unis,Seattle,2020-12-20
1340526973878091779,@natashavote2020 @WarlockWoods @MeidasTouch @KansasResisters Trump,4621809147,littleoldmare,2015-12-27T13:24:21.000Z,"Oregon, USA",Gwen Bush,All people & animals  all forms of life are important to me. laughter is good for the soul.  Married in 1981  I'm a little person  In stature but not in heart.,df7fd3a3b9eff7ee,US,admin,"Oregon, USA","[-124.703541, 41.991795, -116.463262, 46.2990779]",Etats-Unis,Oregon,2020-12-20
1340526935265316865,"Full Video: Trump Supporters Protest at Arizona State Capitol to Demand Election Integrity https://t.co/v6dyk8Ltj8
 
Download our app to read more at https://t.co/VORUb3nrxC",3295943761,dsrved759,2015-07-26T19:03:24.000Z,,Ed Welch,"Husband, father, grandfather, church elder, a defender of the Constitution, US Navy RET.",a592bd6ceb1319f7,US,city,"San Diego, CA","[-117.282538, 32.53962, -116.9274403, 33.0804044]",Etats-Unis,San Diego,2020-12-20
1340526913555709952,"If the fu****’s shoe fits, by all means WEAR IT! Surely you don’t think we’ve already forgotten,have you?? You dare clutch your momma’s pearls while still remaining silent on Trump’s demeaning &amp; other GOP’s name calling?? SMH! https://t.co/L0rqHjn24q",3161573119,JustMe_Marina21,2015-04-17T19:49:02.000Z,Planet Earth ,JustMe.Marina,Titles Don't Impress Me. People Do,5d231ed8656fcf5a,US,city,"St Petersburg, FL","[-82.758209, 27.694323, -82.587597, 27.8971155]",Etats-Unis,St Petersburg,2020-12-20
1340526899278172160,"Derara Lemi a potential candidate of OLF in Arsi, Oromia is in prison. #FreeAllPoliticalPrisonersInEthiopia first to conduct a free and fair election.
@UNDP @EUinEthiopia @DFID_UK @StateDept @USAID @NEBEthiopia @JosepBorrellF
#Plus178CandidatesBehindBars",1319401858058760192,HeboRahima,2020-10-22T22:15:56.000Z,,rahima.hebo@gmail.com,Just have fun with it,300bcc6e23a88361,US,city,"Seattle, WA","[-122.436232, 47.4953154, -122.2249728, 47.734319]",Etats-Unis,Seattle,2020-12-20
1340526875702079493,Biden beat Trump is now clear that neither the courts nor the military will let the defeated loafer hang around for one minute past noon on January 20. His Alantic City eyesore known as the Trump Plaza Hotel and Casino is scheduled for implosion soon after Biden’s inauguration. https://t.co/hqxQQgap2R,19508842,jbaby56,2009-01-25T22:41:57.000Z,"West Orange, NJ",Jbaby56,"Big time Democrat and proud of it! Also business owner Sustainability, Green  Design, Renewable Energy efficient projects, residential and commercial, hit me up",96ddfc4bf2f1a80c,US,city,"West Orange, NJ","[-74.305052, 40.756372, -74.220928, 40.826347]",Etats-Unis,West Orange,2020-12-20
1340526823558373377,"Trump Says Voting Machines May Have Been Breached by SolarWinds Hack During Election https://t.co/bj0FbLqqJk
 
Download our app to read more at https://t.co/VORUb3nrxC",3295943761,dsrved759,2015-07-26T19:03:24.000Z,,Ed Welch,"Husband, father, grandfather, church elder, a defender of the Constitution, US Navy RET.",a592bd6ceb1319f7,US,city,"San Diego, CA","[-117.282538, 32.53962, -116.9274403, 33.0804044]",Etats-Unis,San Diego,2020-12-20
