tweets_id,text,author_id,username,user_created_time,user_location,user_name,user_description,geo_place_id,geo_country_code,geo_place_type,geo_full_name,geo_bbox,geo_country,geo_name,date
1339752242971172866,What is Joe Biden’s plan on bringing Bad Girls Club to steaming services?,19818794,twattwat,2009-01-31T15:37:17.000Z,from where its forever sunny,cyn😈👹,I have an opinion about everything and nothing at the same time 💅🏽,5a110d312052166f,US,city,"San Francisco, CA","[-122.514926, 37.708075, -122.357031, 37.833238]",Etats-Unis,San Francisco,2020-12-18
1339752218203987971,"Watch ""The BIDEN CRIME FAMILY'S Payoff Scheme | Rudy Giuliani's EXCLUSIVE Reaction"" on YouTube https://t.co/IqrEEYGisM via @80_MusicLover__",445820716,patriot_51,2011-12-24T22:52:07.000Z,NYC,Patriot_51🇺🇸,"US NAVY/ VET. 80's Child,Flight instructor. Musician,Father,Friend.Visit My pages Emal:
erikfiles@nycmail.com",00c39537733fa112,US,city,"Queens, NY","[-73.962582, 40.541722, -73.699793, 40.8000371]",Etats-Unis,Queens,2020-12-18
1339752160591044609,@waltshaub Putin owns trump.,17528256,calicokid,2008-11-21T01:28:53.000Z,,calicokid,just a peon resisting,45a45eb8e30e7b14,US,city,"Little Rock, AR","[-92.5215951, 34.6259499, -92.1630491, 34.8178224]",Etats-Unis,Little Rock,2020-12-18
1339752140462419976,"@PaulaChertok @Acosta Putin's hand has been so far up @realDonaldTrump ass, Trump cannot speak.

Tell us about cybersecurity and the gutting of American intelligence agencies Donnie!

Nevermind, He wouldn't tell the truth anyway! https://t.co/VkKMtmndaK",95607921,Genjo_N_Mojave,2009-12-09T09:01:27.000Z,"Los Angeles, CA",Robert 🌻,"Aerospace Quality Eng'r-Mgr./Political Activist/Zen Monk/  
#Yankees/ #Resistance / #FreeTibet  #FreeUkraine  #FreePalenstine 🌻🇺🇦🇺🇸🌻",04291149b14feb9d,US,city,"Lancaster, CA","[-118.280798, 34.6309445, -118.045755, 34.740709]",Etats-Unis,Lancaster,2020-12-18
1339752117695885314,"@realDonaldTrump All this administration had to do was be truthful w/Americans, set the example, encourage people to follow the guidelines, not undermine science, experts, state governments or support conspiracy theories:

https://t.co/bOtyat9ffo

https://t.co/eXDIuTl0GJ

https://t.co/tfSOHndkWf https://t.co/QBt0XWwPED",1631308484,opivali,2013-07-29T21:33:40.000Z,"Virginia Beach, USA",Michael David Kester,https://t.co/q2Z34o9FEw https://t.co/NnCuy3uKRc https://t.co/UDFbKq31pr https://t.co/5JCaTnO70j,84229b03659050aa,US,city,"Virginia Beach, VA","[-76.22808, 36.672684, -75.9118121, 36.932399]",Etats-Unis,Virginia Beach,2020-12-18
1339752081910083587,"You mean like the 2018 GA gubernatorial election? I beg to differ. @staceyabrams handled that with grace, then decisive action. Thank you, Ms Abrams, for flipping GA. https://t.co/Qhyqblforg",61272585,jacobnsbrier,2009-07-29T19:20:31.000Z,Rhode Island,Jacob Brier 💉🇺🇸,Husband &father. Prblm Solver. RIer. Barrington Town Council // Cheerleader of transparency &equity // Introverted ppl person // he/him // Some twts r fake news,171f28605a266e2d,US,city,"Barrington, RI","[-71.353104, 41.705922, -71.285346, 41.7760584]",Etats-Unis,Barrington,2020-12-18
1339752023302918146,"@StevieVanZandt Putin's hand has been so far up @realDonaldTrump ass, Trump cannot speak.

Tell us about cybersecurity and the gutting of American intelligence agencies Donnie!

Nevermind, He wouldn't tell the truth anyway! https://t.co/XLHM4kTi6b",95607921,Genjo_N_Mojave,2009-12-09T09:01:27.000Z,"Los Angeles, CA",Robert 🌻,"Aerospace Quality Eng'r-Mgr./Political Activist/Zen Monk/  
#Yankees/ #Resistance / #FreeTibet  #FreeUkraine  #FreePalenstine 🌻🇺🇦🇺🇸🌻",04291149b14feb9d,US,city,"Lancaster, CA","[-118.280798, 34.6309445, -118.045755, 34.740709]",Etats-Unis,Lancaster,2020-12-18
1339752022745051137,"@KamalaHarris @JoeBiden Nooo, 50 days until we HAVE to call Joe Biden president. #Neolibsarefake",1267719610364604416,Truthte71168415,2020-06-02T07:33:16.000Z,"Orange County, Ca",Truthteller,"I relentlessly tell the truth while humorously destroying the egos of liars, the willfully ignorant, and the wicked.",0562e9e53cddf6ec,US,city,"Santa Ana, CA","[-117.944051, 33.691774, -117.830826, 33.78821]",Etats-Unis,Santa Ana,2020-12-18
1339752010825011201,"@brneydash1987 No more hacking, just sent $ to the Biden Foundation!",14203700,wcmcghee2,2008-03-23T21:18:24.000Z,"Washington, DC",wcmcghee2,,4ddec4770a850303,US,city,"Waldorf, MD","[-76.985159, 38.608878, -76.841929, 38.660379]",Etats-Unis,Waldorf,2020-12-18
1339751968084996099,@dpakman TRUMP going to JAIL,375821323,jeanedsully,2011-09-18T20:01:44.000Z,"Massachusetts, USA",Jean,open minded,2c1b499801cd0ef4,US,city,"Brockton, MA","[-71.080136, 42.042695, -70.973413, 42.126438]",Etats-Unis,Brockton,2020-12-18
1339751967275552768,We need a trump crimes commission. It’s not just the pandemic that needs investigation. https://t.co/V1c6VzvYLB,28845836,Lindag3333,2009-04-04T18:42:52.000Z,"New York, USA",Linda Gonzalez 🇺🇦,"Retired press. 7th generation Ellis island descendant Italy, Ukraine. Biden/Harris",859b7f1502db8fe9,US,city,"Binghamton, NY","[-75.95015, 42.067082, -75.857034, 42.156489]",Etats-Unis,Binghamton,2020-12-18
1339751956525568005,Lin Wood Makes Bizarre Claims About Chief Justice John Roberts | Law &amp; Crime https://t.co/HfOsABCVuo,1933966231,LindaItalian,2013-10-04T11:08:48.000Z,"Gainesville, Florida",Linda Ann deplorable Italian cat lover,"#MAGA ,#KAG, Bucaneers, Gators and Steelers fan. Christian, #1A, Animal rights ,PRO Israel, #BREXIT,  SRV, Scorpions,#BLUE, #2A,Pro all life, Fearless, GEMINI ♊",4ec01c9dbc693497,US,admin,"Florida, USA","[-87.634643, 24.396308, -79.974307, 31.001056]",Etats-Unis,Florida,2020-12-18
1339751946731839489,"@dbongino I fear, if Biden prevails,  January 21st will be a fiasco.  Patriots will most likely storm DC and stop it forcibly. There's not enough security to stop millions",73409332,zroadruner,2009-09-11T15:27:32.000Z,"Freedom Fighter Maryland, USA",Hans Kronheim,"God, Guns and Guts built this Republic. Elections are the battle, Liberty is the War. We may lose a battle, but We Must NEVER lose the war! Sic Semper Tyrannis",006393a101afc714,US,city,"Lake Shore, MD","[-76.534012, 39.078029, -76.433328, 39.167034]",Etats-Unis,Lake Shore,2020-12-18
1339751900162437124,"@KimStrassel @WSJ Look, Biden has set himself up for Impeachment. Disgustingly corrupt. @realDonaldTrump @WhiteHouse @PressSec @GOPChairwoman @marklevinshow @JesseBWatters @Varneyco @MZHemingway @MariaBartiromo @KellyannePolls @JesseBWatters @marklevinshow @TuckerCarlson @KatiePavlich @foxnews",31500475,striperam,2009-04-15T19:57:36.000Z,"Los Alamos, NM",Richard A. Martin,"BSE66 UofMich; MSME71 USC; Ph.D.75 ISU. LANL 30 yr. NASA 6 yr. LAPD 6 yr. YMCA, LASC, LAMOA. BSA SM 7 yr. UNM AdjProf 25 yrs. G-B BJJ, Kiwanis, Gunsite.",230cb82a58fde850,US,city,"White Rock, NM","[-106.223347, 35.801757, -106.171657, 35.830552]",Etats-Unis,White Rock,2020-12-18
1339751896249036803,"@kylegriffin1 Is this because Trump has to screw things up over money, price?",766419583465127936,Kassern1,2016-08-18T23:40:42.000Z,"Ojai, CA",Kassern,"teacher retired, political junky, tried to ring the bell for decades warning of days like this.",18f6de28def360c7,US,city,"Oak View, CA","[-119.311083, 34.369871, -119.2765552, 34.415528]",Etats-Unis,Oak View,2020-12-18
1339751847616122880,"@AFP Putin's hand has been so far up @realDonaldTrump ass, Trump cannot speak. 

""Inexcusable Silence""!

Tell us about cybersecurity and the gutting of American intelligence agencies Donnie!

Nevermind, He wouldn't tell the truth anyway! https://t.co/xKRKDMySJ3",95607921,Genjo_N_Mojave,2009-12-09T09:01:27.000Z,"Los Angeles, CA",Robert 🌻,"Aerospace Quality Eng'r-Mgr./Political Activist/Zen Monk/  
#Yankees/ #Resistance / #FreeTibet  #FreeUkraine  #FreePalenstine 🌻🇺🇦🇺🇸🌻",04291149b14feb9d,US,city,"Lancaster, CA","[-118.280798, 34.6309445, -118.045755, 34.740709]",Etats-Unis,Lancaster,2020-12-18
1339751835209494530,"@NikkiHaley Please, indulge us and expand upon your tweet. Precisely what has trump done in foreign affairs that ""makes us more safe?"" Refrain from using personal opinions, just give us facts and measurable accomplishments.",1022631666,LuceResists,2012-12-19T18:39:32.000Z,Etats-Unis,"Lucy MPH,DrPH candidate","RN, MPH. DrPH (PhD) student. Democrat all the way. BIDEN/HARRIS. Viva la resistance! No DM's please. #Resist #BLM #LGBTQ",226b21641df42460,US,admin,"New Hampshire, USA","[-72.557247, 42.6969837, -70.575095, 45.305476]",Etats-Unis,New Hampshire,2020-12-18
1339751833317879808,@Bruceb2The @BSHerrle @SrSwanson1 @PogueMoran @LibertaEst @ASK_Esq29 @deny_or_defend @FlockeyTom @adartproducer @scarletstwin @TrumpThumper22 @tpel78 @ShillExposer @JoanisMarvin @jgkight61 @Cryptic_Vyper @janne_clark @KyManInTheWoods @aleeyun_nvaazun @estocker8 @LaKathie @ConcernedHigh @Veritas_2016 @JulieBBetz @MaQe_My_Day @Dibbiegirl @JonRHansen @hoplite300 @jobeeswing @Tactical_review @DrBoHammer @uniquedeehan1 @InTheMiddleWit2 @disarray2017 @ElizAKByrd @VanWagoner @QSimpleAnswers @ik1tt3n @brother_itchy @Razuman3 @Plantagenet2019 @HrhOrchid @PowderedWhiskey @desrev01 @Geisler831 @El_Brendo @EpochTimes @abcnews @CBSNews @NBCNews Right. When Mueller testified before the House he was only animated by the Russians interference in our election.,886258860633280513,EveylnM67,2017-07-15T16:19:13.000Z,USA,Evelyn Middleton,"Retired RN. How do we help
each other get through this pandemic?
Wear your mask, wash your hands frequently and cont. distancing. 🌊",5635c19c2b5078d1,US,admin,"Virginie, USA","[-83.67529, 36.540739, -75.16644, 39.466012]",Etats-Unis,Virginie,2020-12-18
1339751792695857154,"Normal overnight gifts of dinner must go overnight...I just paid $288.03 to overnight tamales from Ventura County to Memphis.
Guess new way to enrich the rich.
Another USPS &amp; Trump Administration fail.",4790465233,BarbStC64,2016-01-20T21:17:31.000Z,NBP,Lady Barbara St Charles,"In Honor of All who believe in Truth, Justice, & Democracy I
We Stand with Ukraine🌻",0509a6acb3d27ec4,US,city,"Thousand Oaks, CA","[-119.061758, 34.126875, -118.776015, 34.2500812]",Etats-Unis,Thousand Oaks,2020-12-18
1339751768826159107,"Why can’t we just say it? Trump is a Russian asset. It isn’t even conspiratorial at this point. We heard him on stage at Helsinki, we watched him ignore bounties on our troops and now silence on the hack. What should we think as rational adults? https://t.co/ZiKcnLCBMo",28388111,JakesForLuck,2009-04-02T18:17:36.000Z,"Denver, CO",I am the Dan in the box,"Marine veteran. I post pictures of my cats. Calm down. “If you wish to make an apple pie from scratch, you must first invent the universe” - Carl Sagan",b49b3053b5c25bf5,US,city,"Denver, CO","[-105.109815, 39.614151, -104.734372, 39.812975]",Etats-Unis,Denver,2020-12-18
1339751674114527233,@sjmille64201139 Trump us guilty as hell! Once again his silence in the face of this hack speaks volumes.,829345678153248769,bitterfruit_ci,2017-02-08T15:06:32.000Z,"Long Beach, CA",Constance Istratescu,Contrarian; emigrant; atheist; pantheist; humanist; Neanderthal; public defender & damn good trial attorney; #Resist; #RestorativeJusticeNow; #GeneralStrikeNow,01c060cf466c6ce3,US,city,"Long Beach, CA","[-118.250227, 33.732905, -118.0631938, 33.885438]",Etats-Unis,Long Beach,2020-12-18
1339751630967857154,‘We Want Them All Infected’: HHS Distances Itself From Trump Appointee Who Repeatedly Pushed For ‘Herd Immunity’ https://t.co/USth8nU3QV,3536855062,momoffafa,2015-09-03T18:54:36.000Z,"from  NJ, now lives in PA",robin huziarski,"mom of three wonderful children, widowed (my husband was a wonderful man), studied music and ran track w/Leagers, NEVER TRUMPER !!!",7dc76c5fd4c473fb,US,city,"East Stroudsburg, PA","[-75.19626, 40.983946, -75.161432, 41.02404]",Etats-Unis,East Stroudsburg,2020-12-18
1339751625032916993,@Amy_Siskind Trump appointed a whole lot of unqualified white men.,897447166893068288,ScottWa68503749,2017-08-15T13:17:33.000Z,,Scott Wallace,Professor of Economics,7dc5c6d3bfb10ccc,US,admin,"Wisconsin, USA","[-92.889433, 42.491921, -86.24955, 47.309715]",Etats-Unis,Wisconsin,2020-12-18
1339751612294733826,@Jules9800 @22zzem @LuciaRendn4 @HillaryClinton Trump told them to believe that...🙄,1297359182983622656,AaaHaa51732268,2020-08-23T02:25:30.000Z,"California, USA",🐾AaaHaa🐾,"The ocean is my heaven! Be kind! No DM's 
#RESIST *^*COVID-19 be gone!! 😷
💙🐶 TUFFY 🐕💙 #1 Chihuahua 
Liars disgust me!! #BidenHarris2020",0807c31007ea6b4b,US,city,"Hemet, CA","[-117.071232, 33.685766, -116.908609, 33.7729906]",Etats-Unis,Hemet,2020-12-18
1339751575896662023,Without any ID and were allowed to vote Totally voter fraud I back you Trump all the way,1017858054807867392,Tammysp83615726,2018-07-13T19:47:25.000Z,,Tammy spears,,94965b2c45386f87,US,admin,"New York, USA","[-79.76259, 40.477383, -71.777492, 45.015851]",Etats-Unis,New York,2020-12-18
1339751566954389506,"I doubt it! The threat of that has not stopped them yet. They just make their own laws, do not obey the old ones and play the denial game. Our laws HAVE TO GROW SOME TEETH, and they better start working on that soon because if our dear PRESIDENT DONALD J. TRUMP IS NOT BACK IN.... https://t.co/B29P4BZvXb",1327666708459479042,SBookalis,2020-11-14T17:36:51.000Z,,Susan Bookalis,,e8ad2641c1cb666c,US,admin,"Arkansas, USA","[-94.61771, 33.004106, -89.644838, 36.499767]",Etats-Unis,Arkansas,2020-12-18
1339751538210684935,@bridget_joy_ I would rather never see Trump again.,720992461,johnrdanieltx,2012-07-27T22:22:01.000Z,"Reno, NV",How wonderful to have “normal” political issues.,🌎Socially liberal. Believer of balanced budgets. Total hater of gaslighting. #Resist,4b25aded08900fd8,US,city,"Reno, NV","[-119.953849, 39.350749, -119.700515, 39.674123]",Etats-Unis,Reno,2020-12-18
1339751503167332352,"@BrianKarem @PressSec Someone paid big bucks to publicly say stuff won't utter

President. Elect. Biden.

Am I missing something?
#GroupOfFuckers",17079308,RJMay3,2008-10-31T02:26:24.000Z,"Phoenix, AZ",The Department of Injustice💰,"I will defend anyone wearing a mask, from bullying...
Fuck around and find out!

#EnoughIsEnough
#FuckVanillaISIS
#BlackLivesMatter",0015cc0d71d49e19,US,city,"Buckeye, AZ","[-112.6265495, 33.355798, -112.461428, 33.5154415]",Etats-Unis,Buckeye,2020-12-18
1339751444984057857,"@RadioFreeTom You would think experience would matter and be a qualification, yet Trump is President.",757769521054650368,PamMeador1,2016-07-26T02:48:27.000Z,"Roanoke, VA",Pammy,,9d63050d3d33d32f,US,city,"Roanoke, VA","[-80.037735, 37.211374, -79.878085, 37.337603]",Etats-Unis,Roanoke,2020-12-18
1339751438105280513,"@FOX42KPTM Putin's hand has been so far up @realDonaldTrump ass, Trump cannot speak.

Tell us about cybersecurity and the gutting of American intelligence agencies Donnie!

Nevermind, He wouldn't tell the truth anyway! https://t.co/m235dMdCm1",95607921,Genjo_N_Mojave,2009-12-09T09:01:27.000Z,"Los Angeles, CA",Robert 🌻,"Aerospace Quality Eng'r-Mgr./Political Activist/Zen Monk/  
#Yankees/ #Resistance / #FreeTibet  #FreeUkraine  #FreePalenstine 🌻🇺🇦🇺🇸🌻",04291149b14feb9d,US,city,"Lancaster, CA","[-118.280798, 34.6309445, -118.045755, 34.740709]",Etats-Unis,Lancaster,2020-12-18
1339751396434993152,It is FUCKING OVER. TWITTER YOU NEED TO SHUT EVERYBODY DOWN UNTIL PRESIDENT ELECT BIDEN AND VICE PRESIDENT ELECT KAMALA HARRIS  THIS IS GETTING OLD ORANGE MAN LOST. HE IS A SORE LOSER AND SO ARE ALL OF HIS MAGATS https://t.co/4tlS5divf6,4182293655,betyclyde,2015-11-13T23:54:13.000Z,"Abingdon, IL",Jeani,"I am the Black Sheep of the family. I stay to myself so there is no drama.  I didn't say it, I wasn't there. Love baseball and the Cardinals ⚾⚾⚾⚾⚾⚾⚾⚾⚾⚾⚾⚾⚾⚾⚾⚾⚾⚾⚾",f54a2170ff4b15f7,US,admin,"Illinois, USA","[-91.51308, 36.970298, -87.019935, 42.508303]",Etats-Unis,Illinois,2020-12-18
1339751349702062082,"@EricTrump Liar , you did ask Ukrainian president to humiliate the Biden’s . We do remember",49738832,Basel_Bushnaq,2009-06-22T19:40:41.000Z,USA,Basel Bushnaq,,000cb0c147eb2f2a,US,city,"Sterling, VA","[-77.435297, 38.982892, -77.371585, 39.024981]",Etats-Unis,Sterling,2020-12-18
1339751348586213376,"@denverpost Putin's hand has been so far up @realDonaldTrump ass, Trump cannot speak.

Tell us about cybersecurity and the gutting of American intelligence agencies Donnie!

Nevermind, He wouldn't tell the truth anyway! https://t.co/QqAfWD2jBD",95607921,Genjo_N_Mojave,2009-12-09T09:01:27.000Z,"Los Angeles, CA",Robert 🌻,"Aerospace Quality Eng'r-Mgr./Political Activist/Zen Monk/  
#Yankees/ #Resistance / #FreeTibet  #FreeUkraine  #FreePalenstine 🌻🇺🇦🇺🇸🌻",04291149b14feb9d,US,city,"Lancaster, CA","[-118.280798, 34.6309445, -118.045755, 34.740709]",Etats-Unis,Lancaster,2020-12-18
1339751322229170176,"According to authorities the Russian Hack of Military &amp; other Government computers was massive. At this  point no one knows what has &amp; what has not been infiltrated.Trump, the Russian doofus pawn has not uttered a word.Just an incompetent useless fool who has failed to protect us",322279925,JohnFCorbin,2011-06-22T22:44:26.000Z,,John F Corbin,Part time writer-US Navy Veteran-Corpman-FMF 5th Marine Div-Colorado State University-#Resist-No Trump-no RWNJ’s or religious nuts.#VeteransAgainstTrump,140800566259f12f,US,city,"Sparks, NV","[-119.781386, 39.5117966, -119.640003, 39.636636]",Etats-Unis,Sparks,2020-12-18
1339751287513112576,@iam_dr_cha0s @joshtpm Correct. It’s unconstitutional and completely nonsensical. Trump will get slammed immediately.,793152181574656000,Bairbarber,2016-10-31T18:06:30.000Z,"Princeton, WV",Jackson Barber,"Retired and enjoys my back porch. Proud Democrat who loves reading Palmer report and Tea pain. pro- democracy, pro-rights.",2d83c71ce16cd187,US,admin,"West Virginia, USA","[-82.644739, 37.201483, -77.7189303, 40.638802]",Etats-Unis,West Virginia,2020-12-18
1339751269142065166,@thehill Yes let’s all be appalled by her language yet all the stuff trump had said is ok.  Got it.,125391516,sbschulte,2010-03-22T17:16:38.000Z,,SBS,,4d80887f93883b3f,US,city,"Uniontown, OH","[-81.422343, 40.940326, -81.371258, 40.994167]",Etats-Unis,Uniontown,2020-12-18
1339751250108116992,"@VICE Putin's hand has been so far up @realDonaldTrump ass, Trump cannot speak.

Tell us about cybersecurity and the gutting of American intelligence agencies Donnie!

Nevermind, He wouldn't tell the truth anyway! https://t.co/0qtpCIjHOd",95607921,Genjo_N_Mojave,2009-12-09T09:01:27.000Z,"Los Angeles, CA",Robert 🌻,"Aerospace Quality Eng'r-Mgr./Political Activist/Zen Monk/  
#Yankees/ #Resistance / #FreeTibet  #FreeUkraine  #FreePalenstine 🌻🇺🇦🇺🇸🌻",04291149b14feb9d,US,city,"Lancaster, CA","[-118.280798, 34.6309445, -118.045755, 34.740709]",Etats-Unis,Lancaster,2020-12-18
1339751206340706306,@Acosta Donald Trump doesn't do the work of President. He is also in Putin's back pocket. The guy is a national security disaster.,827002570380034048,tcrampton55,2017-02-02T03:55:52.000Z,Michigan,Tom Crampton,"Husband, Father, Grandfather, and lover of the outdoors. I have a low tolerance for rascals and miscreants.",76ad816c29482c9b,US,city,"Bloomfield Township, MI","[-83.325363, 42.529187, -83.206336, 42.620953]",Etats-Unis,Bloomfield Township,2020-12-18
1339751191161360384,@davidaxelrod @realDonaldTrump @JoeBiden Trump is consistent,419201580,Sloot2070,2011-11-23T02:40:57.000Z,"Parker , CO",Mark Schlueter مارك,Former HR Manager for chain of convenience Stores. Republican the first 30 years of my life until they moved far too the Right. Progressive Independent now,005d9455753e7700,US,city,"Parker, CO","[-104.813236, 39.478431, -104.708485, 39.568631]",Etats-Unis,Parker,2020-12-18
1339751186782584834,"@thehill Putin's hand has been so far up @realDonaldTrump ass, Trump cannot speak.

Tell us about cybersecurity and the gutting of American intelligence agencies Donnie!

Nevermind, He wouldn't tell the truth anyway! https://t.co/YIBijJsNRt",95607921,Genjo_N_Mojave,2009-12-09T09:01:27.000Z,"Los Angeles, CA",Robert 🌻,"Aerospace Quality Eng'r-Mgr./Political Activist/Zen Monk/  
#Yankees/ #Resistance / #FreeTibet  #FreeUkraine  #FreePalenstine 🌻🇺🇦🇺🇸🌻",04291149b14feb9d,US,city,"Lancaster, CA","[-118.280798, 34.6309445, -118.045755, 34.740709]",Etats-Unis,Lancaster,2020-12-18
1339751146324418565,"@marcorubio @Twitter Hey lapdog Rubio...310,000 Dead Americans ... because trump and his GOP enablers, like you, downplayed the seriousness. #TrumpVirusDeathToll300k https://t.co/Ie8Sri9vBu",36475800,orecule,2009-04-29T20:47:07.000Z,"Washington, DC",Eva Maria She/Her/Ella,#NavajoNation #RefugeesWelcome #BLM #AnimalLover #PugFam #RepublicansAreTheProblem,01fbe706f872cb32,US,city,"Washington, DC","[-77.119401, 38.801826, -76.909396, 38.9953797]",Etats-Unis,Washington,2020-12-18
1339751084580024324,@colbertlateshow @StephenAtHome @JoeBiden @DrBiden Georgia! NEVER forget that Loeffler and Perdue did NOT do enough to support Trump! BOYCOTT THE RUNOFFS!!!,2243907186,BuhMule,2013-12-13T13:25:05.000Z,"Texas, USA",Jennifer S Jackson-Hooks,Proud to be an angry Democrat.,da714a0bda9efd55,US,city,"Highlands, TX","[-95.08943, 29.7921626, -95.02753, 29.846673]",Etats-Unis,Highlands,2020-12-18
1339751077403619336,What?????  Lou Dobbs Tonight 12/17/20 FULL | Fox Business Breaking News Trump Dec 1... https://t.co/RkyL312ePy via @YouTube,1342628454,LoLoLorine3,2013-04-10T19:07:45.000Z,"Shreveport, LA",“Not marquee Christian American” Lorine Spratt,"Changed by and a follower of the Resurrected Christ; conservative, and proud mother of Kimberly, Eddie, & Jordan.",4ec71fc3f2579572,US,city,"Shreveport, LA","[-93.938883, 32.332455, -93.679985, 32.589759]",Etats-Unis,Shreveport,2020-12-18
1339751051927285760,"@FOX42KPTM Putin's hand has been so far up @realDonaldTrump ass, Trump cannot speak.

Tell us about cybersecurity and the gutting of American intelligence agencies Donnie!

Nevermind, He wouldn't tell the truth anyway! https://t.co/cGmIyrF9CL",95607921,Genjo_N_Mojave,2009-12-09T09:01:27.000Z,"Los Angeles, CA",Robert 🌻,"Aerospace Quality Eng'r-Mgr./Political Activist/Zen Monk/  
#Yankees/ #Resistance / #FreeTibet  #FreeUkraine  #FreePalenstine 🌻🇺🇦🇺🇸🌻",04291149b14feb9d,US,city,"Lancaster, CA","[-118.280798, 34.6309445, -118.045755, 34.740709]",Etats-Unis,Lancaster,2020-12-18
tweets_id,text,author_id,username,user_created_time,user_location,user_name,user_description,geo_place_id,geo_country_code,geo_place_type,geo_full_name,geo_bbox,geo_country,geo_name,date
1339796065701277697,"@AP When States have been told to expect fewer doses of the Pfizer vaccine, team Trump is up to no good. What are they up to? No good.But it's probably classified like everything else about the White House's handling of the coronavirus epidemic.Democracy cannot coexist with darkness.",1231590638,LarryBoorstein,2013-03-01T21:41:03.000Z,"Virginia, USA",Laurence (Larry) Boorstein,Project Management Professional PMP® Certified Scrum Master CSM® Scrum Master Certified SMC™ MBA Finance CE Civil Engineering–Projects in 18 states 29 countries,ec212eb1116b92e2,US,city,"Reston, VA","[-77.393246, 38.90861, -77.304868, 39.002993]",Etats-Unis,Reston,2020-12-18
1339796047556616192,@realDonaldTrump Trump church is at the golf course! REPUBLICANS have the Weakest church in the world! Coronavirus is their religious beliefs! Pretend disciples of Trump's coronavirus TEAM! REPUBLICANS say God will bless America with the coronavirus virus! TRUMP can't defend me!,1283892357700612097,CraigCharley6,2020-07-16T22:33:01.000Z,,Craig Charley,fishing and hunting,df7fd3a3b9eff7ee,US,admin,"Oregon, USA","[-124.703541, 41.991795, -116.463262, 46.2990779]",Etats-Unis,Oregon,2020-12-18
1339796026102865920,"@marcorubio With all due respect Senator, your supreme leader Trump constantly calls names, mocks the disabled, belittles women and demeans more than half the citizens of this great nation.... and now you are offended?  Please.",486287755,13addison,2012-02-08T04:04:21.000Z,United States,Addie13,,47aff34722fae115,US,city,"Arlington, MA","[-71.2020954, 42.397429, -71.132174, 42.436652]",Etats-Unis,Arlington,2020-12-18
1339796002337923080,@KristenClarkeJD exactly; more frivolous lawsuits from Trump,70130563,dabrams2021,2009-08-30T14:31:29.000Z,"iPhone: 35.848959,-78.692313",Doug Abrams,"atty, avid hockey fan back again as a Carolina Hurricanes fan b/c character matters; hoping Brind'Amour is right; offshore fishing; plays/records rock n roll.",3b98b02fba3f9753,US,admin,"North Carolina, USA","[-84.3219475, 33.752879, -75.40012, 36.588118]",Etats-Unis,North Carolina,2020-12-18
1339796000790237184,....and the other side of the coin that makes Trump look worse yet again. https://t.co/SoHVesQcCq,202843975,JRzepecki,2010-10-14T23:20:59.000Z,"Grand Rapids, MI",Jon Rzepecki,Head chef can't be chopping lettuce.,a81f9ed24c15d6af,US,city,"Grand Rapids, MI","[-85.751406, 42.883679, -85.530877, 43.029144]",Etats-Unis,Grand Rapids,2020-12-18
1339795978111643649,"After Biden gets sworn in, if Donald Trump isn’t taken off twitter, I expect every designer and developer to resign. 😐

For tech workers especially, your labor is an endorsement.",17803933,RussellSkaggs,2008-12-02T09:20:02.000Z,"Columbus, OH",Russell,Creative Technologist. UX Developer. Larper. Dad. Husband. Human. Views are my own. 💖💜💙 #BlackLivesMatter,3df0e3eb1e91170b,US,city,"Columbus, OH","[-83.200169, 39.832013, -82.7713751, 40.157354]",Etats-Unis,Columbus,2020-12-18
