tweets_id,text,author_id,username,user_created_time,user_location,user_name,user_description,geo_place_id,geo_country_code,geo_place_type,geo_full_name,geo_bbox,geo_country,geo_name,date
1340304243908096003,"@GovMikeHuckabee And does anyone wonder why God is putting USA under judgment.
I guess the supreme court will have time to rule on that just like they did on same sex marrage, but a fraudlent election decision is not important .  Thank you, kavanaugh, barrett. Robert's.  Back stabbers to the PPL.",1218223520192376832,Ellie4Trump2020,2020-01-17T17:33:11.000Z,,Ellie,his banner over me is live - Jesus Christ,dcf91ad1aa1fc725,US,city,"Red Lion, PA","[-76.621488, 39.887271, -76.590592, 39.911066]",Etats-Unis,Red Lion,2020-12-19
1340304180666396677,We must fight for freedom!  We must stand for Liberty! We must resist their efforts to turn us into socialists. Be there on January 6th!!!! #Trump,32786967,eclark23,2009-04-18T04:34:47.000Z,,Chicken Dancer,"bok, bok, bok",2526edd24c06e60c,US,admin,"Missouri, USA","[-95.774704, 35.995476, -89.098843, 40.613641]",Etats-Unis,Missouri,2020-12-19
1340304159854215170,"I’ve been kicking around my 50 favorite moments of the Trump Era, starting from when he came down the escalator in 2015 up to the present. It cannot be overstated how much material is going to get left on the cutting room floor.",73566694,ouddin,2009-09-12T04:08:16.000Z,"Chicago, Illinois",Omar,"Civil and Commercial Litigator. Second-Class Intellect, First-Class Temperament.",1d9a5370a355ab0c,US,city,"Chicago, IL","[-87.940033, 41.644102, -87.523993, 42.0230669]",Etats-Unis,Chicago,2020-12-19
1340304144834412547,"@kaneb2013 @Mystic_DMT @hoonoo111 @Iris26053904 @murray_nyc @realDonaldTrump @FoxNews Funnier, there are several videos of Biden fondling young girls. Not accusations, videos that you can see what he is. Oh yes, and sniffing their hair. Yuk, what’s with that?",66778192,Marymac6,2009-08-18T19:43:54.000Z,Colorado,Marymac43,"Triage RN-attended MBA post BSN-Buckaroo G'mother. Defender of Real American, working, taxpaying, PI, Native American descent. No fools, 1/2 truths, PROFANITY.",007c58020ae5952e,US,city,"Cascade, CO","[-105.009247, 38.891492, -104.963069, 38.927635]",Etats-Unis,Cascade,2020-12-19
1340304040836546561,"@politico I was wondering what happened to this. It will go the way of Trump steaks, Trump U and the rest.",118220176,GiseleDubson,2010-02-28T00:05:39.000Z,"Boulder, CO",GiseleD#maskitalready,64-year-old bag of osteoarthritis. Democrat for life! No DMs.,fd70c22040963ac7,US,city,"Boulder, CO","[-105.3017759, 39.953552, -105.183597, 40.094411]",Etats-Unis,Boulder,2020-12-19
1340304037938405377,"@murray_nyc @Jim_Jordan So You are As said V.  I. lenin an USEFOL IMBECIL. THAT LIKE OBAMA-BIDEN DESTRUCTION OF THE BEST COUNTRY OF THE WORLD... TRAITOR  GO TO RUSIA, CHINA, NORTH COREA, AND OTHER MARXIST COUNTRY AND LIVE HAPPY HOW SLAVE.. GOD BLESS AMERICA AND THE BEST 4TH USA PTE.",973681996080623616,LuisGuz31167337,2018-03-13T22:07:32.000Z,,Luis Guzman,,95f2534ad19f77e9,US,city,"Sunset, FL","[-80.3829685, 25.691133, -80.3332249, 25.716759]",Etats-Unis,Sunset,2020-12-19
1340303944774340620,"""One adviser, who requested anonymity to discuss internal deliberations, said Trump is 'low-key pissed off all the time' and truly believes the race was stolen from him.""
https://t.co/fg1mUagiPH",14790314,stiles,2008-05-15T19:12:30.000Z,Los Angeles,Matt Stiles,"Reporting, viz, code at @gridnews. @USC adjunct. Past: @latimes/@datagraphics @wsj @NPR @TexasTribune",3b77caf94bfc81fe,US,city,"Los Angeles, CA","[-118.668404, 33.704538, -118.155409, 34.337041]",Etats-Unis,Los Angeles,2020-12-19
1340303887337721857,"@realDonaldTrump @RepStefanik 
@HouseGOP 
@SenateGOP 
Any result that does not result in the reelection of President Trump is invalid and not to be ""respected""
The election was STOLEN 
If a murderer gets off on a technicality he is still a murderer 
YOU WILL BE HELD ACCOUNTABLE",846722924031692800,Larry7498,2017-03-28T13:57:31.000Z,"Deer Park, NY",Larry I,"#TRUMP WON!
The election was stolen.
we Now have a fake President  to go with the fake news.

TRUTH SOCIAL @Larry7498

#MAGA

#BidenApocalypse",081822bec6f679d4,US,city,"Deer Park, NY","[-73.354311, 40.740662, -73.295069, 40.783594]",Etats-Unis,Deer Park,2020-12-19
1340303863388266496,@mmpadellan Shhhh!! 🤫 Trump is just paying off his debt's to Putin and the Oligarchs!,1325438972852654083,beene_beth,2020-11-08T14:04:53.000Z,,Beth Beene,"Wife, Mom, Grammy, Liberal, LifeDem, Don't get in my way Woman",dd9c503d6c35364b,US,admin,"Pennsylvania, USA","[-80.519851, 39.719801, -74.689517, 42.516072]",Etats-Unis,Pennsylvania,2020-12-19
1340303838767706112,What happens online is as vital to modern warfare as drones and boots on the ground. Disinformation and most importantly hacking are weapons. Americans do realize what’s just happened is a Pearl Harbor or worse in fir our security right? How is this acceptable to the Trump base?,925039254958374913,GhostofParties,2017-10-30T16:38:39.000Z,"Mississippi, USA",GhostofPartiesPast,Alabaman living in Mississippi. Husband. Dad. Bassist. Producer. Sun-hating vinyl junkie. Owner at @dialbacksound Bass gtr @drivebytruckers @dexateens,f512ff314e1ae1b5,US,city,"Water Valley, MS","[-89.65022, 34.140309, -89.608889, 34.170518]",Etats-Unis,Water Valley,2020-12-19
1340303828558688257,@EricBoehlert @soledadobrien So let’s unpack this. #JohnKelly is rolling with his ‘our institutions saved us’ take. He and so many others around Trump arrogantly thought they would be the adults in the room and save our country. They wanted to give themselves credit for stopping Trump’s worse impulses.,53097556,freelancerjourn,2009-07-02T15:43:45.000Z,,freelancejournalist,BA- Mass Media Arts/Print Journalism; #IndieAuthor; Writer; Copyediting Certifed. Lover of all things lighthouses. IG: freelancerjourn,01fbe706f872cb32,US,city,"Washington, DC","[-77.119401, 38.801826, -76.909396, 38.9953797]",Etats-Unis,Washington,2020-12-19
1340303765002457089,Election officials in Michigan need to go to jail + Georgia!!!,1225191886941556736,newt60440770,2020-02-05T22:58:50.000Z,,Newt,Married conservative,9807c5c5f7a2c6ce,US,admin,"Minnesota, USA","[-97.239256, 43.499362, -89.483385, 49.384359]",Etats-Unis,Minnesota,2020-12-19
1340303739362619392,"Oh my goodness!
Just for the record, I never really cared when “exactly” the vaccine was going to come! Morally, I felt overly irritated of how Trump has been speaking like some health professional when HE’S NOT!
And what the fuck is it with you and this GMO food shit? 🤣😂🤨😒⁉️ https://t.co/px4ljC0FpB",324685598,NickBL88,2011-06-27T01:53:17.000Z,"Indianapolis, IN",Nick Leon,,43aa6d32149a6772,US,city,"Elkhart, IN","[-86.061524, 41.620816, -85.855849, 41.739181]",Etats-Unis,Elkhart,2020-12-19
1340303734111387650,"@CopingMAGA A - They’re hoping to find something on Hunter that strongly ties back to Joe Biden

B - They assume Biden is going to install family members in positions of power",27209858,dgdw,2009-03-28T10:44:39.000Z,"Chicago, IL",Derek Weber,"Opinions are my own & do not represent any past, current or future employers. 🏳️‍🌈",1d9a5370a355ab0c,US,city,"Chicago, IL","[-87.940033, 41.644102, -87.523993, 42.0230669]",Etats-Unis,Chicago,2020-12-19
1340303731666120704,I love seeing the people that have doubled down since trump lost and still have their trump 2020 shit out in their yard. Absolutely admirable dedication to mental illness.,24341293,fukevin,2009-03-14T06:34:53.000Z,The Farplane,Kevin,,58d9017bdf25fa8b,US,city,"West Jefferson, OH","[-83.301882, 39.925842, -83.259962, 39.950127]",Etats-Unis,West Jefferson,2020-12-19
1340303722228948998,10 months ago.    WATCH: Pam Bondi argues Biden corruption concerns are legitimate | Trump... https://t.co/jO8Wn8VT67 via @YouTube,61270347,pokermac2000,2009-07-29T19:10:12.000Z,"Indiana, USA",Patrick McNabb,Citizen of the Universe-Constitutional Conservative-Plumber/Pipe Fitter-30 years UAW-Don’t tread on me.,e6db906395cb3381,US,city,"Danville, IN","[-86.551319, 39.750045, -86.457249, 39.777285]",Etats-Unis,Danville,2020-12-19
1340303693711872001,@Whistleblr @MLZambrana This horror show of a Biden administration would be fun to watch if it didn't mean the rapid decline of a great nation.,3044092450,nsgarn,2015-02-18T00:48:54.000Z,"Virginie, USA",Nate Garn,"A Constitutional Conservative Catholic, Entrepreneur, Pro-Capitalism! Love Wine, Food & Coffee! Married, Father, Grandfather, Godfather",5635c19c2b5078d1,US,admin,"Virginie, USA","[-83.67529, 36.540739, -75.16644, 39.466012]",Etats-Unis,Virginie,2020-12-19
1340303652448169989,If you follow an idiot are you an idiot if you follow a fool are you a fool if you follow a liar are you a liar the answer to all of these is YES And what does that say about you if you think Trump is a decent man then what does that say about you.,1596526964,achilles_cobalt,2013-07-15T18:59:47.000Z,"Seattle, WA",Achilles Cobalt,"Biotechnologist, Writer, Poet, CADist",3912e7cd4cf62c39,US,city,"Lynnwood, WA","[-122.3377166, 47.802196, -122.262542, 47.8537715]",Etats-Unis,Lynnwood,2020-12-19
1340303607212765185,"@marklevinshow So Prompt got stuck pointing to the Russians! Trump's to much of a pussy to call them out! Oh wait! I forgot, it was the payoff for his debt's!",1325438972852654083,beene_beth,2020-11-08T14:04:53.000Z,,Beth Beene,"Wife, Mom, Grammy, Liberal, LifeDem, Don't get in my way Woman",dd9c503d6c35364b,US,admin,"Pennsylvania, USA","[-80.519851, 39.719801, -74.689517, 42.516072]",Etats-Unis,Pennsylvania,2020-12-19
1340303602116681729,@realDonaldTrump I hope Biden gets rid of this program. A tremendous waste of money. That money could be used to help Americans by giving them 2000 dollar stimulus checks but instead we have a stupid ass space force. Trump is so stupid. Can’t wait for him to be forcefully removed from office.,583555637,Fahi6884,2012-05-18T07:15:36.000Z,,Fahi84,I don’t hand out participation trophies,1f531799d2fa515c,US,city,"Ayer, MA","[-71.609576, 42.53697, -71.512096, 42.585131]",Etats-Unis,Ayer,2020-12-19
1340303557422178305,"@JeffMerkley @joebartell A guy that couldn’t get more than 20 people to his rallies before &amp;after the election, won only 16.7% of the counties in the US, stayed in his basement, won with a record number of votes. In some cites receiving 723% of the votes? &amp; there is no fraud?  You think he actually won?",27368057,southrnbandit,2009-03-29T03:05:15.000Z,"America,  U.SofA.",mysouthernwayz,"Follow me: I’m southern and American AF. Believe in working for what I got, taking care of me and mine, and I don’t want the gov. in my business.",288de3df481163e8,US,admin,"Alabama, USA","[-88.473228, 30.144425, -84.888247, 35.008029]",Etats-Unis,Alabama,2020-12-19
1340303498131476480,I'm hoping That President Trump will prove that to the country https://t.co/5ITNeFs0zy,758331973995593728,jarrettmkch,2016-07-27T16:03:26.000Z,"Martinsville, VA",MyNameIsNobody#MKJarrett,GOD#Jesus#HolySpirit#Christian#Husband#Dad#Papa#Family#Neighbor#Church#NASCAR#CountryMusic#Travel#Virginia#Pro-Life#GOP#conservative#BelieveTrump-is-GOD's-hands,462eb95e171583bc,US,city,"Villa Heights, VA","[-79.909119, 36.685486, -79.885558, 36.70628]",Etats-Unis,Villa Heights,2020-12-19
1340303491324112896,Why should Trump act Presidential today?...33 more days of this Reality T.V. Dud! https://t.co/ncTYmT3Mf7,375334624,BowiesNana,2011-09-17T23:13:34.000Z,"Massachusetts, USA",AFW,"I am a teacher, lifelong learner, mother, world traveler, music lover, beach bum and nana.",74f5dce716bb4008,US,city,"Marshfield, MA","[-70.7729481, 42.0616232, -70.638438, 42.162318]",Etats-Unis,Marshfield,2020-12-19
1340303415918944260,@AmyKremer @realDonaldTrump Did you even read the article? 🙄 to overturn the results of a fair and freely contested Election - with record voter turnout - would require Votes - (I know you Trumpsters hate Votes -unless they are for your guy)! This means - both the Senate and the House will have to vote. 🙄,17694237,jayjadeja,2008-11-28T00:27:32.000Z,"Westbury, NY",liberallyliberal,,17ed72e98159e413,US,city,"Oakdale, NY","[-73.157725, 40.725255, -73.111969, 40.755056]",Etats-Unis,Oakdale,2020-12-19
1340303391017328641,My beloved home state of #Pennsylvania: please fire Pat Toomey. He’s holding up covid relief to punish the Biden administration.,3392066349,CoachOdell1987,2015-07-28T14:27:35.000Z,"Madison, WI",Soon to be Dr. Sarah Odell,"Feminist scholar, trouble maker, organizer. Making the world more equitable by burning down one system at a time.",7dc5c6d3bfb10ccc,US,admin,"Wisconsin, USA","[-92.889433, 42.491921, -86.24955, 47.309715]",Etats-Unis,Wisconsin,2020-12-19
1340303382460952578,@TheRickyDavila Oh yeah he was as much a part of things as a Trump was.,3650247017,cathyAnnSmith2,2015-09-14T06:33:02.000Z,"Georgia, USA",cathy Ann Smith2. Cathysmith973@yahoo.com,"wife, mother, mimi",7142eb97ae21e839,US,admin,"Georgia, USA","[-85.605166, 30.355644, -80.742567, 35.000771]",Etats-Unis,Georgia,2020-12-19
1340303348973518849,SHAME ON ALL ARIZONA'S REPUBLICANS. HOW DARE YOU TRY TO OVER THROW THE ELECTION. TRUMP'S PUPPETS THAT'S ALL YOU ARE https://t.co/2qAJ5Jh7Ix,1283914129497972741,ThomasC83643158,2020-07-16T23:59:54.000Z,"Phoenix, AZ",Thomas Coyne,"HORSE'S RULE ALWAYS RULE.
wild horse's RULE ALWAYS RULE.
TRAINING CONTRACTS AVAILABLE. I COME TO YOU AND THE HORSE STAYS WITH YOU.
FOLLOWING DIRECTION'S IS.",5c62ffb0f0f3479d,US,city,"Phoenix, AZ","[-112.3239143, 33.29026, -111.9254391, 33.8154652]",Etats-Unis,Phoenix,2020-12-19
1340303234213306368,"Does Trump happen to have stock in Moderna?  Apparently, he does not have stock in dry ice! https://t.co/AIJBHo1C7O",896549648,Eich97706,2012-10-22T02:04:08.000Z,,Anne W. Eichler,Not good w/ tweets; here to support those who are! Retired teacher. Kids=4; Grandkids=7. LIBERAL Christian. Jesus would have no ken with today's FAR RIGHT!,67d92742f1ebf307,US,admin,"Michigan, USA","[-90.4181075, 41.696088, -82.122971, 48.306272]",Etats-Unis,Michigan,2020-12-19
tweets_id,text,author_id,username,user_created_time,user_location,user_name,user_description,geo_place_id,geo_country_code,geo_place_type,geo_full_name,geo_bbox,geo_country,geo_name,date
1340356484203352066,This has been a Republican state for years. Had to be rigged election https://t.co/hDWDqaL24O,580470850,gravyjohnson,2012-05-15T02:43:27.000Z,phoenix,Greg Johnson,Lives inValley of the Sun Father to Evan and Britt Married to Goo Loves his French bulldog Pearl and his Boxer Lola  Happy retiree !!!,5c62ffb0f0f3479d,US,city,"Phoenix, AZ","[-112.3239143, 33.29026, -111.9254391, 33.8154652]",Etats-Unis,Phoenix,2020-12-19
1340356396978745344,WE ARE AMERICANS FIRST BEFORE BEEN A PARTY MEMBER OUR COUNTRY NEED TO BE PROTECTED NO MATTER WHAT DO YOU UND TRUMP?,329302892,Gzarwea,2011-07-04T21:14:54.000Z,U S A,Gabriel Zarwea,,7b93be1d864cedbb,US,city,"Providence, RI","[-71.4741855, 41.772455, -71.369479, 41.861713]",Etats-Unis,Providence,2020-12-19
1340356381023457280,@realDonaldTrump @DNI_Ratcliffe @SecPompeo Don the Con Trump is a moron and liar. Putin owns Trump. Russia is a dangerous! Trump should move to Russia! He had taken this Country to it’s knees! Drag him out now!!!!!,2724422150,MikeL9443,2014-08-11T18:13:31.000Z,"California, USA",Michael Laiks,,cf574ccb037d4ff3,US,city,"Windsor, CA","[-122.83677, 38.5150105, -122.772142, 38.5669559]",Etats-Unis,Windsor,2020-12-19
1340356370483335178,@larrytomes1 @LLinWood Just means that all the people who hate trump had their votes counted after 3am. I still do not see the point. Why about 2am or 1am or 10pm the precious day. Why not stop after 1 vote??  This is an insane argument.,3221799882,0H__I0,2015-05-21T01:51:51.000Z,"Kennett Square, PA",Cleveland Fan Stuck in Philly,"Buckeyes, Browns, Indians, Cavs fan stuck in the middle of Philadelphia fan country. #dawgcheck #D4L 🇺🇸😷🇺🇸",dd9c503d6c35364b,US,admin,"Pennsylvania, USA","[-80.519851, 39.719801, -74.689517, 42.516072]",Etats-Unis,Pennsylvania,2020-12-19
1340356346898739206,@brackNmild does he know biden hasnt been sworn in yet,259523176,litrally2niggas,2011-03-02T02:24:45.000Z,West Atlanta,Alfredo warrior,"Its Danny • a cook, a dad, and a writer • ♋♊♋ 28 • he/they • $dannnnie •",e229de11a7eb6823,US,city,"Marietta, GA","[-84.5968051, 33.895088, -84.46746, 34.0011594]",Etats-Unis,Marietta,2020-12-19
1340356302707503106,There is #CredibleLawyer or a #CredibleFBIAgent That would do This #Trump is #ScrappingUpGarbage To do His #InsanityCases Plus I don’t think #SidneyPowell has a Brain 🧠 or Credentials to be a #Lawyer !! https://t.co/mFQTeD2Kl1,1183962258,glenwyman,2013-02-16T00:17:31.000Z,"Bethel,ct 06801",Glenwyman,Retired Master Carpenter Travel expert /California/VirginiaBeach /LasVegas security-software-specialist married to Carol Wyman,a5b6bdd8008412b1,US,city,"Danbury, CT","[-73.545122, 41.352784, -73.400835, 41.463455]",Etats-Unis,Danbury,2020-12-19
1340356276799172608,@JoeBiden Joe if it’s true trump is    preemptively pardoning everyone he knows😡 how do we get justice and keep this from happening to our democracy again w another corrupt president?,1005904223593099264,cagirl47aolcom1,2018-06-10T20:07:10.000Z,"California, USA",cagirl47,I am a proud member of the #Resistance.I will not give up I will STAND UP FOR OUR COUNTRY. A FREE AMERICA IS WORTH THE FIGHT. VOTE BLUE A BLUE TSUNAMI IS COMING,ee2cfc9feb061a08,US,city,"Turlock, CA","[-120.912851, 37.459822, -120.812106, 37.53937]",Etats-Unis,Turlock,2020-12-19
1340356237385322496,Because we all know that Trump is Putin’s bitch. https://t.co/X0Ka96IUTA,1703116800,AnzalduaYoung,2013-08-26T23:02:52.000Z,"Tucson, AZ",Mary Anzaldua Young,Love life! Need I say more!,598f1e0ca6a69b63,US,city,"Tanque Verde, AZ","[-110.8128892, 32.23542, -110.72088, 32.308673]",Etats-Unis,Tanque Verde,2020-12-19
1340356218028748800,"If the position of “Just give Ron Johnson what he wants!” is so clever and pragmatic, our president-elect should just scream it from the rooftops. Rack up that good will with his GOP critics. 👍🏼 https://t.co/723nTbTgfE",97273575,Clarknt67,2009-12-16T19:34:22.000Z,"Brooklyn, Baby!","🌹 Clark, a proud citizen of GoFundMe nation","“If I hadn't blown the whole thing years ago, I might not be alone.” A feeble minded president is no match for Joe Manchin. South Detroit Truther.",011add077f4d2da3,US,city,"Brooklyn, NY","[-74.041878, 40.570842, -73.855673, 40.739434]",Etats-Unis,Brooklyn,2020-12-19
1340356088311541765,@semperdiced I thought Sidney Powell was fired because she's out of her mind crazy. Trump's worse every day so he forgot?,90448601,softlikewater,2009-11-16T18:11:10.000Z,Etats-Unis,Barbara,"Democrat trying to stay https://t.co/et4yXRrWtq of NY Rangers, Michigan State Alum. I miss Wayne Dyer. I speak my mind Resistance member #VotedBidenHarris2020 triple vaxxed 🌊",876ed0bcf9594134,US,city,"Long Beach, NY","[-73.701496, 40.582128, -73.637403, 40.595119]",Etats-Unis,Long Beach,2020-12-19
1340356080656891909,"@whackamolio @realDonaldTrump @DNI_Ratcliffe @SecPompeo I am taking a leap here, but I bet a good number of Trump's supporters actually know he lost and are embarrassed at his childish behavior. Not all of of them, but at least some - maybe 70 million?",18292353,gapsjoy,2008-12-21T20:35:12.000Z,Newport News,Greg Perry,Retired Sylvan Learning Owner and retired USAF officer,6f36fc2e52870eee,US,city,"Newport News, VA","[-76.62797, 36.960216, -76.387647, 37.220386]",Etats-Unis,Newport News,2020-12-19
1340356009039192064,Jay Nordlinger it's in plain sight what Trump has done to put the reigns on Russia! Just take your head out of the RINO a$$! https://t.co/J1ULdnHpnw,1245105716366639109,JamesCo73967216,2020-03-31T21:48:54.000Z,,James Coffey,I'm truly open-minded. With common sense. Trump 2020,13eb8d7f6e12a684,US,city,"St Charles, MO","[-90.5706573, 38.737756, -90.464711, 38.848337]",Etats-Unis,St Charles,2020-12-19
1340355924498604032,Russia and China are scariest countries in the world. Out rule the world. Don’t care about human lives. Biden will be weak with both. Watch. They will play him. He’s not tough on anyone https://t.co/izT1JG7guG,580470850,gravyjohnson,2012-05-15T02:43:27.000Z,phoenix,Greg Johnson,Lives inValley of the Sun Father to Evan and Britt Married to Goo Loves his French bulldog Pearl and his Boxer Lola  Happy retiree !!!,5c62ffb0f0f3479d,US,city,"Phoenix, AZ","[-112.3239143, 33.29026, -111.9254391, 33.8154652]",Etats-Unis,Phoenix,2020-12-19
1340355913643945985,https://t.co/ks4KqdgQV4 Election Fraud EVIDENCE,805893330148139008,t_bone1764,2016-12-05T21:55:17.000Z,"Austin, TX",Tyler Hunter,Living in the moment.,e0060cda70f5f341,US,admin,"Texas, USA","[-106.645646, 25.837092, -93.508131, 36.500695]",Etats-Unis,Texas,2020-12-19
1340355892936630274,The @HouseDemocrats need to start articles of impeachment for Trump with his blatant betrayal of our national security and giving safe haven for Vladimir Putin.,821901681231298560,FordJohnathan5,2017-01-19T02:06:45.000Z,"Omaha, NE",Johnathan Ford 🕊,"Reporting the Truth on Twitter. No disinformation, all reporting is verified, views are my own.",6515916567ad4b34,US,city,"Burlington, IA","[-91.167512, 40.763821, -91.094099, 40.858065]",Etats-Unis,Burlington,2020-12-19
1340355888092200964,So I have been watching the usual suspects go on and on in despair about why Trump  has not said anything about Russia. Then when he finally tweets the hair of the usual suspects set fire .... again.,3462193277,RJTheRealOne,2015-08-27T22:40:54.000Z,Miami,RJ Mr No Nonsense,Im a child of the Baroque!,04cb31bae3b3af93,US,city,"Miami, FL","[-80.321683, 25.7090404, -80.144974, 25.855667]",Etats-Unis,Miami,2020-12-19
1340355838263869445,Absolutely correct.  Time to close the trump book &amp; begin a new series w/Biden. 👍🏻 https://t.co/AgmamxpFTR,29124964,Amore47,2009-04-06T02:25:39.000Z,"New York, New York, USA",Jane Abbey,,00c39537733fa112,US,city,"Queens, NY","[-73.962582, 40.541722, -73.699793, 40.8000371]",Etats-Unis,Queens,2020-12-19
1340355800137486337,SDNY are not fools. I’m counting on them to have some iron clad cases against Trump and his dishonorable progeny https://t.co/YEReOon4tZ,1598812760,sddphoto,2013-07-16T16:43:53.000Z,AZ,Sharon Dennis,Freelance photographer - travel-swim-art-nature-science-climate-cooking- culture- classical/jazz enthusiast Instagram: sddphotoworld,5faafada28b440c3,US,city,"Fountain Hills, AZ","[-111.7834, 33.567198, -111.698379, 33.640623]",Etats-Unis,Fountain Hills,2020-12-19
1340355780701253632,"Trump, Pence, GOP, and republican voters who support these murderers , can no longer claim they are the party who protects life . Not after allowing over 300,000 Americans die from COVID-19. 😒😡🤬

#TrumpIsACriminal
#TrumpVirus

https://t.co/GXtDlNJ9dS",1326470121863450624,NastyWomanM95,2020-11-11T10:21:54.000Z,"California, USA",🇺🇸NastyWomanM95😈❤Mi amor Barb❤🚫NoDMs🚫,🚫No DMs🚫❤Mi amor Barbie 😍💍❤Lesbian 🏳️‍🌈 Proud Democrat. I support my President Biden & my VP Kamala Harris❤#VoteBlue2022🌊 #FuckGBM #FuckBrainCancer,7cfaf4a257bca60a,US,city,"Manteca, CA","[-121.300453, 37.7683759, -121.175722, 37.8645309]",Etats-Unis,Manteca,2020-12-19
1340355771553488896,watch Trump try it! https://t.co/NM2OcNKajU,737760101193256961,dennismSTL,2016-05-31T21:38:09.000Z,,Dennis,"tech biz owner...guitar player...I read, a lot!...science, politics...politically LEFT but pragmatic...boosted!",7ae98adb6702f22a,US,city,"Crestwood, MO","[-90.398613, 38.544061, -90.349347, 38.573574]",Etats-Unis,Crestwood,2020-12-19
1340355743694917636,To the person who put up an entirely new trumpet sign in their yard after he officially lost the election — are you okay?,112812556,clairifornia,2010-02-09T19:57:30.000Z,"Murder Mitt, USA",troller blade,👻 fablifeofclaire,67d92742f1ebf307,US,admin,"Michigan, USA","[-90.4181075, 41.696088, -82.122971, 48.306272]",Etats-Unis,Michigan,2020-12-19
1340355686463643655,@RBReich Trump will not say these words because he is not patriots this is the man we make president of our nation shame,329302892,Gzarwea,2011-07-04T21:14:54.000Z,U S A,Gabriel Zarwea,,7b93be1d864cedbb,US,city,"Providence, RI","[-71.4741855, 41.772455, -71.369479, 41.861713]",Etats-Unis,Providence,2020-12-19
1340355678028902400,"Hopefully, Trump will only be able to send Putin love letters from jail soon... https://t.co/CB4VXbhzFW",885261916779761664,GregHiss67,2017-07-12T22:17:43.000Z,"Chicago, IL",Greg Hiss,"Former Republican. Will never vote for another one again.  Dog lover, birdwatcher, tree hugger, Trump hater.",1d9a5370a355ab0c,US,city,"Chicago, IL","[-87.940033, 41.644102, -87.523993, 42.0230669]",Etats-Unis,Chicago,2020-12-19
1340355578976198660,"6/Both State courts and Federal courts, including the Supreme Court, have failed the American people in refusing to appropriately adjudicate the election irregularities that have come before them. Their failures pose a great risk to the American Republic. https://t.co/6kmkUnW8Pf",1463483821,susan_lovelady,2013-05-28T00:30:44.000Z,"Hot Springs, VA",America1st🚫Globalism,Navy Brat.Critical thinker.American sovereignty is good policy.The golden rule.Red-pilled but heartbroken ▪️IFBP🇺🇸 #TRUMP2020 #FJB          GETTR:@seeker45,5635c19c2b5078d1,US,admin,"Virginie, USA","[-83.67529, 36.540739, -75.16644, 39.466012]",Etats-Unis,Virginie,2020-12-19
